{
  "name": "discord",
  "displayName": "Discord",
  "authorizationEndpoint": "https://discord.com/api/oauth2/authorize",
  "tokenEndpoint": "https://discord.com/api/oauth2/token",
  "revocationEndpoint": "https://discord.com/api/oauth2/token/revoke",
  "scopes": [
    "identify",
    "email",
    "connections",
    "guilds",
    "guilds.join",
    "guilds.members.read",
    "gdm.join",
    "messages.read",
    "rpc",
    "rpc.notifications.read",
    "rpc.voice.read",
    "rpc.voice.write",
    "rpc.activities.write",
    "bot",
    "webhook.incoming",
    "applications.builds.upload",
    "applications.builds.read",
    "applications.commands",
    "applications.store.update",
    "applications.entitlements",
    "activities.read",
    "activities.write",
    "relationships.read"
  ],
  "tokenEndpointAuthMethods": ["client_secret_post"],
  "pkceRecommended": false,
  "refreshTokenExpected": true,
  "notes": "Discord OAuth 2.0. Requires app creation in Discord Developer Portal. Bot scope requires additional permissions setup."
}
