{
  "name": "apple",
  "displayName": "Apple",
  "authorizationEndpoint": "https://appleid.apple.com/auth/authorize",
  "tokenEndpoint": "https://appleid.apple.com/auth/token",
  "revocationEndpoint": "https://appleid.apple.com/auth/revoke",
  "scopes": [
    "name",
    "email"
  ],
  "tokenEndpointAuthMethods": [
    "client_secret_post"
  ],
  "pkceRecommended": true,
  "deviceCodeSupported": false,
  "refreshTokenExpected": true,
  "notes": "Sign in with Apple. Requires Apple Developer account and app configuration."
}
