{
  "name": "asana",
  "displayName": "Asana",
  "authorizationEndpoint": "https://app.asana.com/-/oauth_authorize",
  "tokenEndpoint": "https://app.asana.com/-/oauth_token",
  "scopes": [],
  "tokenEndpointAuthMethods": [
    "client_secret_post"
  ],
  "pkceRecommended": false,
  "deviceCodeSupported": false,
  "refreshTokenExpected": true,
  "notes": "Asana OAuth for project management integrations. Requires Asana app registration."
}
