{
  "name": "stripe",
  "displayName": "Stripe",
  "authorizationEndpoint": "https://connect.stripe.com/oauth/authorize",
  "tokenEndpoint": "https://connect.stripe.com/oauth/token",
  "revocationEndpoint": "https://connect.stripe.com/oauth/deauthorize",
  "scopes": [
    "read_write"
  ],
  "tokenEndpointAuthMethods": [
    "client_secret_post"
  ],
  "pkceRecommended": false,
  "deviceCodeSupported": false,
  "refreshTokenExpected": true,
  "extraAuthorizeParams": {
    "response_type": "code"
  },
  "notes": "Stripe Connect OAuth for platform integrations. Requires Stripe Connect account."
}
