{
  "name": "trello",
  "displayName": "Trello",
  "authorizationEndpoint": "https://trello.com/1/authorize",
  "tokenEndpoint": "https://trello.com/1/OAuthGetAccessToken",
  "scopes": [
    "read",
    "write",
    "account"
  ],
  "tokenEndpointAuthMethods": [
    "client_secret_post"
  ],
  "pkceRecommended": false,
  "deviceCodeSupported": false,
  "refreshTokenExpected": false,
  "notes": "Trello OAuth for board and card access. Uses OAuth 1.0a. Access tokens do not expire."
}
