{
  "name": "pinterest",
  "displayName": "Pinterest",
  "authorizationEndpoint": "https://www.pinterest.com/oauth",
  "tokenEndpoint": "https://api.pinterest.com/v5/oauth/token",
  "scopes": [
    "boards:read",
    "boards:write",
    "pins:read",
    "pins:write",
    "user_accounts:read"
  ],
  "tokenEndpointAuthMethods": [
    "client_secret_post"
  ],
  "pkceRecommended": true,
  "deviceCodeSupported": false,
  "refreshTokenExpected": true,
  "notes": "Pinterest OAuth for accessing boards and pins. Requires Pinterest app registration."
}
