{
  "name": "paypal",
  "displayName": "PayPal",
  "authorizationEndpoint": "https://www.paypal.com/signin/authorize",
  "tokenEndpoint": "https://api.paypal.com/v1/oauth2/token",
  "scopes": [
    "openid",
    "profile",
    "email"
  ],
  "tokenEndpointAuthMethods": [
    "client_secret_basic"
  ],
  "pkceRecommended": false,
  "deviceCodeSupported": false,
  "refreshTokenExpected": true,
  "notes": "PayPal OAuth for payment processing and user identity. Requires PayPal app registration."
}
