{
  "name": "google",
  "displayName": "Google",
  "authorizationEndpoint": "https://accounts.google.com/o/oauth2/v2/auth",
  "tokenEndpoint": "https://oauth2.googleapis.com/token",
  "revocationEndpoint": "https://oauth2.googleapis.com/revoke",
  "scopes": [
    "openid",
    "email",
    "profile",
    "https://www.googleapis.com/auth/userinfo.email",
    "https://www.googleapis.com/auth/userinfo.profile"
  ],
  "tokenEndpointAuthMethods": [
    "client_secret_post",
    "client_secret_basic"
  ],
  "pkceRecommended": true,
  "deviceCodeSupported": false,
  "refreshTokenExpected": true,
  "extraAuthorizeParams": {
    "access_type": "offline",
    "prompt": "consent"
  },
  "notes": "Google often requires prompt=consent + access_type=offline for refresh tokens."
}
